{
  "contractVersion": 1,
  "designSystem": {
    "id": "hello-world",
    "sha256": "{{DESIGN_HASH}}"
  },
  "acceptedConcept": {
    "id": "{{PROJECT_ID}}"
  },
  "entry": "src/reportApplication.tsx",
  "files": [
    {
      "path": "src/reportApplication.tsx",
      "content": "import { useEffect, useMemo, useState, type ReactElement } from \"react\";\nimport type { ReportApplicationProps } from \"./reportRuntime\";\n\ninterface CatalogRow {\n  type: string;\n  parent: string;\n  entity: string;\n}\n\nexport function ReportApplication({ model, onVisibleDatasetsChange }: ReportApplicationProps): ReactElement {\n  const [query, setQuery] = useState(\"\");\n  useEffect(() => onVisibleDatasetsChange?.([\"model-catalog\"]), [onVisibleDatasetsChange]);\n\n  const dataset = model.datasets[\"model-catalog\"];\n  const rows = useMemo<CatalogRow[]>(() => (dataset?.points ?? [])\n    .map((point) => ({\n      type: point.dimensions[0]?.label ?? \"Entity\",\n      parent: point.dimensions[1]?.label ?? \"\",\n      entity: point.dimensions[2]?.label ?? point.label,\n    }))\n    .sort((left, right) => left.type.localeCompare(right.type)\n      || left.parent.localeCompare(right.parent)\n      || left.entity.localeCompare(right.entity)), [dataset]);\n\n  const normalizedQuery = query.trim().toLowerCase();\n  const visibleRows = normalizedQuery\n    ? rows.filter((row) => [row.type, row.parent, row.entity].some((value) => value.toLowerCase().includes(normalizedQuery)))\n    : rows;\n  const counts = rows.reduce<Record<string, number>>((result, row) => {\n    result[row.type] = (result[row.type] ?? 0) + 1;\n    return result;\n  }, {});\n  const connected = rows.length > 0;\n\n  return <main className=\"hello-world\">\n    <header className=\"hero\">\n      <div>\n        <p className=\"eyebrow\">Super Visual / connectivity proof</p>\n        <h1>Hello, semantic model.</h1>\n        <p className=\"lede\">This searchable catalog arrived through the same governed semantic provider used by every Super Visual application.</p>\n      </div>\n      <p className={connected ? \"connection connected\" : \"connection waiting\"} role=\"status\">\n        <span aria-hidden=\"true\" />\n        {connected ? \"Connected · \" + rows.length + \" entities\" : \"Waiting for semantic data…\"}\n      </p>\n    </header>\n\n    <section className=\"summary\" aria-label=\"Semantic model summary\">\n      {Object.entries(counts).map(([type, count]) => <div key={type}><strong>{count}</strong><span>{type}{count === 1 ? \"\" : \"s\"}</span></div>)}\n    </section>\n\n    <section className=\"catalog\" aria-labelledby=\"catalog-title\">\n      <div className=\"catalog-heading\">\n        <div><h2 id=\"catalog-title\">Semantic model entities</h2><p>Tables, columns, measures, hierarchies, relationships, and parameters declared by the model.</p></div>\n        <label className=\"search\"><span>Search entities</span><input type=\"search\" value={query} onChange={(event) => setQuery(event.currentTarget.value)} placeholder=\"Search type, parent, or name\" /></label>\n      </div>\n      {!connected ? <p className=\"empty\">The page will populate when the semantic adapter returns its first broker rows.</p>\n        : visibleRows.length === 0 ? <p className=\"empty\">No semantic entities match “{query}”.</p>\n        : <div className=\"table-scroll\"><table>\n          <thead><tr><th scope=\"col\">Type</th><th scope=\"col\">Parent</th><th scope=\"col\">Entity</th></tr></thead>\n          <tbody>{visibleRows.map((row) => <tr key={[row.type, row.parent, row.entity].join(\"\\u0000\")}><td><span className=\"type\">{row.type}</span></td><td>{row.parent || \"—\"}</td><th scope=\"row\">{row.entity}</th></tr>)}</tbody>\n        </table></div>}\n    </section>\n  </main>;\n}\n"
    },
    {
      "path": "style/report-design.less",
      "content": ".hello-world { box-sizing: border-box; min-height: 100%; padding: 32px; color: #173c36; background: #f4f7f5; font-family: Aptos, \"Segoe UI\", sans-serif; }\n.hello-world * { box-sizing: border-box; }\n.hero { display: flex; gap: 32px; align-items: flex-start; justify-content: space-between; max-width: 1200px; margin: 0 auto; }\n.eyebrow { margin: 0 0 8px; color: #167d6c; font-size: 12px; font-weight: 700; letter-spacing: .12em; text-transform: uppercase; }\n.hero h1 { margin: 0; font: 600 clamp(36px, 6vw, 64px)/1 Georgia, serif; }\n.lede { max-width: 720px; margin: 16px 0 0; color: #5e6d68; font-size: 17px; line-height: 1.5; }\n.connection { display: inline-flex; flex: 0 0 auto; gap: 8px; align-items: center; margin: 4px 0 0; padding: 9px 13px; border: 1px solid #d3ddd8; border-radius: 999px; background: #fff; color: #5e6d68; font-size: 13px; font-weight: 700; }\n.connection span { width: 9px; height: 9px; border-radius: 50%; background: #9b6b23; }\n.connection.connected span { background: #2e7d5b; box-shadow: 0 0 0 3px #dcebe5; }\n.summary { display: flex; flex-wrap: wrap; gap: 1px; max-width: 1200px; margin: 28px auto 0; overflow: hidden; border: 1px solid #d3ddd8; border-radius: 8px; background: #d3ddd8; }\n.summary div { display: grid; min-width: 128px; flex: 1 1 128px; gap: 3px; padding: 16px 18px; background: #fff; }\n.summary strong { font: 600 28px/1 Georgia, serif; }\n.summary span { color: #5e6d68; font-size: 12px; }\n.catalog { max-width: 1200px; margin: 18px auto 0; overflow: hidden; border: 1px solid #d3ddd8; border-radius: 8px; background: #fff; }\n.catalog-heading { display: flex; gap: 24px; align-items: end; justify-content: space-between; padding: 22px 24px; border-bottom: 1px solid #d3ddd8; }\n.catalog-heading h2 { margin: 0; font-size: 20px; }\n.catalog-heading p { margin: 6px 0 0; color: #5e6d68; font-size: 13px; }\n.search { display: grid; min-width: min(340px, 100%); gap: 6px; color: #5e6d68; font-size: 12px; font-weight: 700; }\n.search input { width: 100%; padding: 10px 12px; border: 1px solid #b9c7c0; border-radius: 6px; color: #173c36; background: #fff; font: inherit; font-size: 14px; font-weight: 400; }\n.search input:focus { outline: 3px solid #b8ddd5; outline-offset: 1px; border-color: #167d6c; }\n.table-scroll { overflow-x: auto; }\n.catalog table { width: 100%; border-collapse: collapse; text-align: left; }\n.catalog th, .catalog td { padding: 13px 24px; border-bottom: 1px solid #e3eae6; }\n.catalog thead th { color: #5e6d68; background: #f8faf9; font-size: 11px; letter-spacing: .08em; text-transform: uppercase; }\n.catalog tbody th { font-weight: 600; }\n.catalog tbody td { color: #5e6d68; }\n.catalog tbody tr:last-child th, .catalog tbody tr:last-child td { border-bottom: 0; }\n.type { display: inline-block; padding: 4px 8px; border-radius: 999px; color: #126858; background: #e5f2ee; font-size: 11px; font-weight: 700; }\n.empty { margin: 0; padding: 32px 24px; color: #5e6d68; }\n@media (max-width: 720px) {\n  .hello-world { padding: 20px; }\n  .hero, .catalog-heading { align-items: stretch; flex-direction: column; }\n  .search { min-width: 0; }\n  .catalog th, .catalog td { padding: 12px 16px; }\n}\n"
    }
  ],
  "routes": [
    {
      "id": "overview",
      "title": "Semantic Model Catalog",
      "datasets": [
        "model-catalog"
      ],
      "businessQuestionIds": [
        "semantic-connectivity"
      ]
    }
  ],
  "bindings": [
    {
      "dataset": "model-catalog",
      "component": "searchable-table",
      "reportWidgetIds": [
        "model-catalog"
      ],
      "businessQuestionIds": [
        "semantic-connectivity"
      ]
    }
  ],
  "designRationale": {
    "direction": "A searchable semantic-model catalog that proves the governed provider path.",
    "pageCompositions": [
      "One semantic-model catalog page"
    ],
    "dataVisualisation": [
      "Searchable semantic-entity table and entity-type counts"
    ],
    "responsiveBehaviour": [
      "Summary cards wrap and the semantic table scrolls horizontally on narrow screens."
    ],
    "accessibility": [
      "Labelled search input, semantic table headings, visible numeric counts, and a live connection status."
    ],
    "risks": [
      "Catalog rows prove the report-to-semantic-provider path; source refresh remains a separate deployment acceptance check."
    ]
  }
}
